{
  "$schema": "../../schema/prediction.schema.json",
  "schemaVersion": 1,
  "trackId": "b5050f4f88b5336789a9e796ed31850c3e0f8427ab99a8e61d6e75fa184d5e46",
  "generatedAt": "2026-07-11T06:53:03.604Z",
  "algorithm": {
    "version": 16,
    "formatVersion": 1,
    "strategy": "production-equivalent-replay-v16-pseudo-color-rust-default",
    "decoderBackend": "rust-default",
    "gitHead": "8e086ce5fcbbc300a6b3c17ecb037e009ecef0c8",
    "dirty": false
  },
  "durationSec": 373.342,
  "gridKind": "fixed",
  "analysisMs": 79.35,
  "sections": [
    {
      "startSec": 0.025,
      "endSec": 30.993,
      "startBar": 1,
      "endBar": 16,
      "phraseIndex": 0,
      "kind": "intro",
      "confidence": 1,
      "energy": 0.383,
      "low": 0.708,
      "high": 0.651,
      "novelty": 0.23
    },
    {
      "startSec": 30.993,
      "endSec": 61.96,
      "startBar": 17,
      "endBar": 32,
      "phraseIndex": 2,
      "kind": "groove",
      "confidence": 1,
      "energy": 0.575,
      "low": 0.822,
      "high": 0.421,
      "novelty": 0.407
    },
    {
      "startSec": 61.96,
      "endSec": 92.928,
      "startBar": 33,
      "endBar": 48,
      "phraseIndex": 4,
      "kind": "breakdown",
      "confidence": 1,
      "energy": 0.28,
      "low": 0.57,
      "high": 0.498,
      "novelty": 0.398
    },
    {
      "startSec": 92.928,
      "endSec": 123.896,
      "startBar": 49,
      "endBar": 64,
      "phraseIndex": 6,
      "kind": "build",
      "confidence": 1,
      "energy": 0.469,
      "low": 0.599,
      "high": 0.518,
      "novelty": 0.241
    },
    {
      "startSec": 123.896,
      "endSec": 185.831,
      "startBar": 65,
      "endBar": 96,
      "phraseIndex": 8,
      "kind": "drop",
      "confidence": 1,
      "energy": 0.651,
      "low": 0.833,
      "high": 0.447,
      "novelty": 0.4
    },
    {
      "startSec": 185.831,
      "endSec": 232.283,
      "startBar": 97,
      "endBar": 120,
      "phraseIndex": 12,
      "kind": "breakdown",
      "confidence": 1,
      "energy": 0.361,
      "low": 0.554,
      "high": 0.384,
      "novelty": 0.483
    },
    {
      "startSec": 232.283,
      "endSec": 247.767,
      "startBar": 121,
      "endBar": 128,
      "phraseIndex": 15,
      "kind": "build",
      "confidence": 1,
      "energy": 0.491,
      "low": 0.316,
      "high": 0.615,
      "novelty": 0.216
    },
    {
      "startSec": 247.767,
      "endSec": 340.67,
      "startBar": 129,
      "endBar": 176,
      "phraseIndex": 16,
      "kind": "drop",
      "confidence": 1,
      "energy": 0.632,
      "low": 0.801,
      "high": 0.461,
      "novelty": 0.384
    },
    {
      "startSec": 340.67,
      "endSec": 373.342,
      "startBar": 177,
      "endBar": 193,
      "phraseIndex": 22,
      "kind": "outro",
      "confidence": 1,
      "energy": 0.381,
      "low": 0.73,
      "high": 0.564,
      "novelty": 0.365
    }
  ]
}
